,id,user_name,tweet_text,user_followers,user_location,user_verified,like_count,rt_count,timestamp
305,1072198399406063617,David Davis,I have urged the Prime Minister to go to Brussels and push for a time-limited Northern Ireland backstop As it stands the Withdrawal Agreement hands all the negotiating power to the EU It fails to take back control of our laws our borders or our money.,145725,,True,1913,619,2018-12-10 18:36:33
306,1071790839653912578,David Davis,We need a new strategy of hope vision and imagination Next Tuesday is make or break it’s time to defeat this wretched deal and get on with the future,145725,,True,3570,1412,2018-12-09 15:37:03
307,1071441934449819649,David Davis,The Conservative Party has a key role in this That role is not to attempt to bully MPs into support for a failed strategy Our role is to come together to find a joint approach that supports the decision of the referendum and promotes the national interest.,145725,,True,1116,321,2018-12-08 16:30:38
308,1071441933493506050,David Davis,To do this we need to preserve our freedom of action on trade on regulations on migration on fishing We must not subordinate ourselves to partisan foreign institutions Democracy demands no less.,145725,,True,1084,317,2018-12-08 16:30:38
309,1071441932478570496,David Davis,We will be judged in the future as to whether we flinched in the face of unfounded threats and panic or stood up for our national interest and took our proper place in the world.,145725,,True,1292,518,2018-12-08 16:30:37
310,1071441931480244224,David Davis,It is a common clich of political speeches that we stand at a turning point in history For once however it is true The decisions taken in the next few months will dictate our nation's future for a generation.,145725,,True,2402,829,2018-12-08 16:30:37
